{
  "$schema": "https://json-schema.org/draft/2020-12/schema",
  "$id": "https://github.com/fbgallet/philoscopia-open/blob/main/schemas/philosophers.schema.json",
  "title": "philosophers",
  "description": "A philosopher profile: positions on axes, with sourced justifications. Generated from the source Zod schemas. This captures structure only; cross-file and cross-field rules (reference resolution, graph acyclicity, pole-count-by-type, weights summing to 1, etc.) are enforced by the corpus validator, not expressible in JSON Schema.",
  "type": "object",
  "properties": {
    "kind": {
      "type": "string",
      "const": "PHILOSOPHER"
    },
    "id": {
      "type": "string",
      "pattern": "^[a-z0-9][a-z0-9-]*$"
    },
    "name": {
      "type": "object",
      "properties": {
        "fr": {
          "type": "string",
          "minLength": 1
        },
        "en": {
          "type": "string",
          "minLength": 1
        }
      },
      "required": [
        "fr",
        "en"
      ],
      "additionalProperties": false
    },
    "tagline": {
      "type": "object",
      "properties": {
        "fr": {
          "type": "string",
          "minLength": 1
        },
        "en": {
          "type": "string",
          "minLength": 1
        }
      },
      "required": [
        "fr",
        "en"
      ],
      "additionalProperties": false
    },
    "aliases": {
      "type": "object",
      "properties": {
        "fr": {
          "type": "array",
          "items": {
            "type": "string"
          }
        },
        "en": {
          "type": "array",
          "items": {
            "type": "string"
          }
        }
      }
    },
    "identity": {
      "type": "object",
      "properties": {
        "wikidata": {
          "type": "string",
          "pattern": "^Q\\d+$"
        },
        "wikipedia": {
          "type": "object",
          "properties": {
            "fr": {
              "type": "string",
              "format": "uri"
            },
            "en": {
              "type": "string",
              "format": "uri"
            }
          },
          "additionalProperties": false
        }
      },
      "required": [
        "wikidata"
      ],
      "additionalProperties": false
    },
    "summary": {
      "type": "object",
      "properties": {
        "fr": {
          "type": "string",
          "minLength": 1
        },
        "en": {
          "type": "string",
          "minLength": 1
        }
      },
      "required": [
        "fr",
        "en"
      ],
      "additionalProperties": false
    },
    "entries": {
      "default": [],
      "type": "array",
      "items": {
        "type": "object",
        "properties": {
          "axisId": {
            "type": "string",
            "pattern": "^[A-Z][A-Z0-9_]*$"
          },
          "status": {
            "type": "string",
            "enum": [
              "POSITIONED",
              "NO_POSITION",
              "CONTEXTUALIST",
              "REJECTS_ALTERNATIVE",
              "NOT_APPLICABLE"
            ]
          },
          "declaredValue": {
            "oneOf": [
              {
                "type": "object",
                "properties": {
                  "kind": {
                    "type": "string",
                    "const": "scalar"
                  },
                  "value": {
                    "type": "number",
                    "minimum": -1,
                    "maximum": 1
                  }
                },
                "required": [
                  "kind",
                  "value"
                ],
                "additionalProperties": false
              },
              {
                "type": "object",
                "properties": {
                  "kind": {
                    "type": "string",
                    "const": "weights"
                  },
                  "weights": {
                    "minItems": 2,
                    "type": "array",
                    "items": {
                      "type": "number",
                      "minimum": 0,
                      "maximum": 1
                    }
                  }
                },
                "required": [
                  "kind",
                  "weights"
                ],
                "additionalProperties": false
              }
            ]
          },
          "practicedValue": {
            "oneOf": [
              {
                "type": "object",
                "properties": {
                  "kind": {
                    "type": "string",
                    "const": "scalar"
                  },
                  "value": {
                    "type": "number",
                    "minimum": -1,
                    "maximum": 1
                  }
                },
                "required": [
                  "kind",
                  "value"
                ],
                "additionalProperties": false
              },
              {
                "type": "object",
                "properties": {
                  "kind": {
                    "type": "string",
                    "const": "weights"
                  },
                  "weights": {
                    "minItems": 2,
                    "type": "array",
                    "items": {
                      "type": "number",
                      "minimum": 0,
                      "maximum": 1
                    }
                  }
                },
                "required": [
                  "kind",
                  "weights"
                ],
                "additionalProperties": false
              }
            ]
          },
          "epistemicStatus": {
            "type": "string",
            "enum": [
              "EXPLICIT",
              "INFERABLE",
              "EXTRAPOLATED",
              "UNDOCUMENTED"
            ]
          },
          "salience": {
            "type": "string",
            "enum": [
              "MAJOR",
              "MINOR",
              "NOT_RELEVANT"
            ]
          },
          "justification": {
            "type": "object",
            "properties": {
              "text": {
                "type": "object",
                "properties": {
                  "fr": {
                    "type": "string",
                    "minLength": 1
                  },
                  "en": {
                    "type": "string",
                    "minLength": 1
                  }
                },
                "required": [
                  "fr",
                  "en"
                ],
                "additionalProperties": false
              },
              "references": {
                "minItems": 1,
                "type": "array",
                "items": {
                  "type": "object",
                  "properties": {
                    "fr": {
                      "type": "string",
                      "minLength": 1
                    },
                    "en": {
                      "type": "string",
                      "minLength": 1
                    }
                  },
                  "required": [
                    "fr",
                    "en"
                  ],
                  "additionalProperties": false
                }
              },
              "quoteId": {
                "type": "string",
                "pattern": "^[a-z0-9][a-z0-9-]*$"
              },
              "strength": {
                "type": "string",
                "enum": [
                  "STRONG",
                  "MEDIUM",
                  "WEAK"
                ]
              },
              "argumentIds": {
                "type": "array",
                "items": {
                  "type": "string",
                  "pattern": "^[a-z0-9][a-z0-9-]*$"
                }
              }
            },
            "required": [
              "text",
              "references",
              "strength"
            ],
            "additionalProperties": false
          },
          "note": {
            "type": "object",
            "properties": {
              "fr": {
                "type": "string",
                "minLength": 1
              },
              "en": {
                "type": "string",
                "minLength": 1
              }
            },
            "required": [
              "fr",
              "en"
            ],
            "additionalProperties": false
          }
        },
        "required": [
          "axisId",
          "status"
        ],
        "additionalProperties": false
      }
    },
    "structuring": {
      "type": "array",
      "items": {
        "type": "object",
        "properties": {
          "axisId": {
            "type": "string",
            "pattern": "^[A-Z][A-Z0-9_]*$"
          },
          "thesis": {
            "type": "object",
            "properties": {
              "fr": {
                "type": "string",
                "minLength": 1
              },
              "en": {
                "type": "string",
                "minLength": 1
              }
            },
            "required": [
              "fr",
              "en"
            ],
            "additionalProperties": false
          }
        },
        "required": [
          "axisId"
        ],
        "additionalProperties": false
      }
    },
    "stub": {
      "type": "boolean",
      "const": true
    },
    "fullName": {
      "type": "object",
      "properties": {
        "fr": {
          "type": "string",
          "minLength": 1
        },
        "en": {
          "type": "string",
          "minLength": 1
        }
      },
      "required": [
        "fr",
        "en"
      ],
      "additionalProperties": false
    },
    "birth": {
      "type": "integer",
      "minimum": -9007199254740991,
      "maximum": 9007199254740991
    },
    "death": {
      "type": "integer",
      "minimum": -9007199254740991,
      "maximum": 9007199254740991
    },
    "datesApprox": {
      "type": "boolean",
      "const": true
    },
    "language": {
      "type": "string",
      "enum": [
        "grc",
        "lat",
        "ara",
        "fas",
        "heb",
        "san",
        "pli",
        "bod",
        "lzh",
        "jpn",
        "ita",
        "fra",
        "eng",
        "deu",
        "dan",
        "rus",
        "nld",
        "nor",
        "guj",
        "swe"
      ]
    },
    "otherLanguages": {
      "type": "array",
      "items": {
        "type": "string",
        "enum": [
          "grc",
          "lat",
          "ara",
          "fas",
          "heb",
          "san",
          "pli",
          "bod",
          "lzh",
          "jpn",
          "ita",
          "fra",
          "eng",
          "deu",
          "dan",
          "rus",
          "nld",
          "nor",
          "guj",
          "swe"
        ]
      }
    },
    "oral": {
      "type": "boolean",
      "const": true
    },
    "area": {
      "type": "string",
      "enum": [
        "EAST_ASIA",
        "SOUTH_ASIA",
        "ISLAMIC_WORLD",
        "WEST"
      ]
    },
    "nationality": {
      "type": "object",
      "properties": {
        "fr": {
          "type": "string",
          "minLength": 1
        },
        "en": {
          "type": "string",
          "minLength": 1
        }
      },
      "required": [
        "fr",
        "en"
      ],
      "additionalProperties": false
    },
    "movements": {
      "type": "array",
      "items": {
        "type": "string",
        "pattern": "^[a-z0-9][a-z0-9-]*$"
      }
    },
    "updatedAt": {
      "type": "string"
    },
    "validation": {
      "type": "object",
      "properties": {
        "method": {
          "type": "string",
          "enum": [
            "DOUBLE_LLM_PASS",
            "EXPERT_REVIEW",
            "NOT_VALIDATED"
          ]
        },
        "convergenceScore": {
          "type": "number",
          "minimum": 0,
          "maximum": 1
        }
      },
      "required": [
        "method"
      ],
      "additionalProperties": false
    }
  },
  "required": [
    "kind",
    "id",
    "name",
    "summary",
    "movements",
    "updatedAt",
    "validation"
  ],
  "additionalProperties": false
}
