{
  "kind": "PHILOSOPHER",
  "id": "weber",
  "stub": true,
  "name": {
    "fr": "Max Weber",
    "en": "Max Weber"
  },
  "aliases": {
    "fr": ["wébérien", "wébérienne"],
    "en": ["Weberian"]
  },
  "summary": {
    "fr": "Sociologue et penseur politique allemand : il définit l'État moderne par le monopole de la violence physique légitime, et oppose l'éthique de conviction à l'éthique de responsabilité, qui assume les conséquences d'un usage mesuré de la force.",
    "en": "German sociologist and political thinker: he defines the modern state by its monopoly on legitimate physical violence, and opposes the ethics of conviction to the ethics of responsibility, which owns the consequences of a measured use of force."
  },
  "birth": 1864,
  "death": 1920,
  "nationality": {
    "fr": "Allemand",
    "en": "German"
  },
  "language": "deu",
  "movements": [],
  "updatedAt": "2026-07-02T00:00:00.000Z",
  "validation": {
    "method": "NOT_VALIDATED"
  }
}
