{
  "kind": "PHILOSOPHER",
  "id": "parmenides",
  "stub": true,
  "name": {
    "fr": "Parménide",
    "en": "Parmenides"
  },
  "aliases": {
    "fr": ["parménidien", "parménidienne"],
    "en": ["Parmenidean"]
  },
  "summary": {
    "fr": "Fondateur de l'ontologie : son poème De la nature oppose la voie de la vérité, l'Être un, immuable, ingénéré et impérissable, à la voie de l'opinion des mortels ; penser le changement, c'est déjà accorder l'être au non-être, ce qui est impossible.",
    "en": "Founder of ontology: his poem On Nature opposes the way of truth, Being one, immutable, ungenerated and imperishable, to the way of mortal opinion; to think change is already to grant being to non-being, which is impossible."
  },
  "birth": -515,
  "death": -450,
  "nationality": {
    "fr": "Grec (Élée)",
    "en": "Greek (Elea)"
  },
  "datesApprox": true,
  "language": "grc",
  "movements": [],
  "updatedAt": "2026-07-02T00:00:00.000Z",
  "validation": {
    "method": "NOT_VALIDATED"
  }
}
