{
  "kind": "PHILOSOPHER",
  "id": "searle",
  "name": {
    "fr": "Searle",
    "en": "Searle"
  },
  "aliases": {
    "fr": [
      "searlien",
      "searlienne"
    ],
    "en": [
      "Searlean"
    ]
  },
  "summary": {
    "fr": "Philosophe américain de l'esprit et du langage : contre le fonctionnalisme, il tient la conscience pour un phénomène biologique, produit par les pouvoirs causaux propres du cerveau vivant.",
    "en": "American philosopher of mind and language: against functionalism, he holds consciousness to be a biological phenomenon, produced by the specific causal powers of the living brain."
  },
  "nationality": {
    "fr": "Américain",
    "en": "American"
  },
  "birth": 1932,
  "death": 2025,
  "language": "eng",
  "movements": [
    "analytic-philosophy"
  ],
  "identity": {
    "wikidata": "Q295012",
    "wikipedia": {
      "fr": "https://fr.wikipedia.org/wiki/John_Searle",
      "en": "https://en.wikipedia.org/wiki/John_Searle"
    }
  },
  "updatedAt": "2026-07-25T00:00:00.000Z",
  "validation": {
    "method": "NOT_VALIDATED"
  },
  "fullName": {
    "fr": "John Searle",
    "en": "John Searle"
  },
  "tagline": {
    "fr": "Il tient la conscience pour un fait biologique aussi ordinaire que la digestion : être vécue à la première personne ne la rend pas immatérielle. Ce qui lui vaut d'être rejeté des deux camps qu'il rejette lui-même.",
    "en": "He holds consciousness to be a biological fact as ordinary as digestion: being lived in the first person does not make it immaterial. Which earns him the rejection of both camps he himself rejects."
  },
  "entries": [
    {
      "axisId": "CONSCIOUSNESS_NATURE",
      "status": "POSITIONED",
      "declaredValue": {
        "kind": "weights",
        "weights": [
          0,
          0.15,
          0,
          0.85,
          0
        ]
      },
      "epistemicStatus": "EXPLICIT",
      "salience": "MAJOR",
      "justification": {
        "text": {
          "fr": "Searle tient la conscience pour un phénomène biologique ordinaire, au même titre que la digestion ou la photosynthèse : elle est causée par des processus neuronaux de bas niveau et se réalise dans le cerveau comme une propriété de plus haut niveau. <arg>De ce qu'un état est vécu à la première personne, il ne suit pas qu'il soit immatériel : son mode d'existence est subjectif, sa nature reste biologique.</arg> Ce <c>naturalisme biologique</c> refuse les deux camps hérités, le <c id='dualism'>dualisme</c> qui fait de l'esprit une autre substance, et les <c id='materialism'>matérialismes</c> qui, pour sauver l'objectivité, finissent par tenir le vécu pour négligeable. <obj>Ses critiques répliquent qu'une irréductibilité de principe le rapproche malgré lui du dualisme des propriétés</obj> : il conteste en distinguant la <c>réduction causale</c>, qu'il accorde puisque le cerveau produit bien la conscience, de la réduction ontologique, qui supprimerait le point de vue à première personne au lieu de l'expliquer. C'est ce qui décide de sa place ici : l'irréductibilité qu'il maintient est bien celle du caractère subjectif du vécu, qu'il tient pour une <c>ontologie à la première personne</c>, mais elle ne fait pas de la conscience une propriété qui s'ajouterait au cerveau. La conscience est pour lui une manière d'être du cerveau lui-même, à un niveau supérieur, non un ingrédient de plus dans l'inventaire du monde.",
          "en": "Searle holds consciousness to be an ordinary biological phenomenon, on a par with digestion or photosynthesis: it is caused by low-level neuronal processes and realized in the brain as a higher-level property. <arg>That a state is lived in the first person does not entail that it is immaterial: its mode of existence is subjective, its nature remains biological.</arg> This <c>biological naturalism</c> refuses both inherited camps, the <c id='dualism'>dualism</c> that makes mind another substance, and the <c id='materialism'>materialisms</c> that, to save objectivity, end up treating lived experience as negligible. <obj>His critics reply that an irreducibility of principle brings him despite himself close to property dualism</obj>: he disputes this by distinguishing <c>causal reduction</c>, which he grants since the brain does produce consciousness, from ontological reduction, which would delete the first-person point of view instead of explaining it. This is what settles his place here: the irreducibility he maintains is indeed that of the subjective character of experience, which he holds to be a <c>first-person ontology</c>, but it does not make consciousness a property added to the brain. For him consciousness is a way the brain itself is, at a higher level, not one more ingredient in the inventory of the world."
        },
        "references": [
          {
            "fr": "« Minds, Brains, and Programs » (1980)",
            "en": "\"Minds, Brains, and Programs\" (1980)"
          },
          {
            "fr": "La Redécouverte de l'esprit (1992)",
            "en": "The Rediscovery of the Mind (1992)"
          }
        ],
        "strength": "STRONG"
      },
      "note": {
        "fr": "Searle récuse aussi bien l'étiquette matérialiste que dualiste. Son classement suit sa thèse : la conscience est causée par le cerveau et réalisée en lui. La part accordée au dualisme des propriétés reflète une lecture contestée de son irréductibilité, qu'il rejette.",
        "en": "Searle rejects both the materialist and the dualist label. His placement follows his thesis: consciousness is caused by the brain and realized in it. The weight given to property dualism reflects a contested reading of his irreducibility, which he rejects."
      }
    },
    {
      "axisId": "MACHINE_MIND",
      "status": "POSITIONED",
      "declaredValue": {
        "kind": "scalar",
        "value": 0
      },
      "epistemicStatus": "EXPLICIT",
      "salience": "MAJOR",
      "justification": {
        "text": {
          "fr": "La <te id='chinese-room'>chambre chinoise</te> : enfermé dans une pièce, Searle manipule des symboles chinois selon un manuel de règles, et ses réponses passent pour celles d'un locuteur, sans qu'il comprenne un mot. <arg>Un programme n'est qu'une <c>syntaxe</c>, un jeu de règles portant sur des formes ; comprendre exige en plus une <c>sémantique</c>, un rapport au monde que la manipulation formelle ne fournit jamais.</arg> Il n'en conclut pourtant pas que seul le vivant pense : le cerveau est une machine, et un artefact qui reproduirait ses <c>pouvoirs causaux</c> penserait. Ce qu'il refuse n'est donc pas la machine pensante, mais l'idée qu'exécuter le bon programme y suffise.",
          "en": "The <te id='chinese-room'>Chinese room</te>: shut in a room, Searle manipulates Chinese symbols following a rulebook, and his answers pass for a speaker's, without his understanding a word. <arg>A program is only a <c>syntax</c>, a set of rules bearing on shapes; understanding further requires a <c>semantics</c>, a relation to the world that formal manipulation never supplies.</arg> Yet he does not conclude that only the living think: the brain is a machine, and an artefact reproducing its <c>causal powers</c> would think. What he refuses is therefore not the thinking machine, but the idea that running the right program suffices."
        },
        "references": [
          {
            "fr": "« Minds, Brains, and Programs » (1980)",
            "en": "\"Minds, Brains, and Programs\" (1980)"
          }
        ],
        "strength": "STRONG"
      }
    },
    {
      "axisId": "REDUCTION_EMERGENCE",
      "status": "POSITIONED",
      "declaredValue": {
        "kind": "scalar",
        "value": 0.2
      },
      "epistemicStatus": "EXPLICIT",
      "salience": "MAJOR",
      "justification": {
        "text": {
          "fr": "Searle tient la conscience pour une propriété de haut niveau causée par les processus neuronaux, comme la liquidité de l'eau est causée par le comportement des molécules alors qu'aucune molécule n'est liquide. <arg>L'<c>émergence</c> qu'il accepte est celle-là : explicable à partir des parties une fois leur organisation connue.</arg> <obj>Il refuse en revanche toute propriété qui posséderait des pouvoirs causaux inexplicables à partir des éléments</obj>, ce qui reviendrait selon lui à de la magie. <dif>Il est donc à peine du côté de l'émergence, et pas du tout du côté d'un tout mystérieux.</dif>",
          "en": "Searle holds consciousness to be a higher-level property caused by neuronal processes, as the liquidity of water is caused by the behaviour of molecules although no molecule is liquid. <arg>The <c>emergence</c> he accepts is that one: explicable from the parts once their organization is known.</arg> <obj>He refuses, by contrast, any property that would possess causal powers inexplicable from the elements</obj>, which would amount, he says, to magic. <dif>He therefore sits barely on the emergentist side, and not at all on the side of a mysterious whole.</dif>"
        },
        "references": [
          {
            "fr": "La Redécouverte de l'esprit (1992)",
            "en": "The Rediscovery of the Mind (1992)"
          }
        ],
        "strength": "STRONG"
      }
    }
  ]
}
